{
  "totalRecords": 350,
  "meta": {
    "generatedAt": "2026-03-20T00:00:00Z",
    "source": "audit_schedule_execution_data"
  },
  "avgAuditsInProgress": {
    "description": "Average count of audits currently In Progress per auditor across the full team.",
    "totalInProgressAudits": 98,
    "totalAuditors": 7,
    "averagePerAuditor": 14
  },
  "avgLapsedAudits": {
    "description": "Average count of audits in Lapsed status per auditor across the team.",
    "totalLapsedAudits": 21,
    "totalAuditorsWithLapsed": 7,
    "averageLapsedPerAuditor": 3
  },
  "zoneWithMaxDelayedAudits": {
    "description": "Top zones ranked by total count of Lapsed or Not Executed audits.",
    "topZones": [
      {
        "zoneName": "West Zone",
        "totalDelayedAudits": 20,
        "lapsedCount": 12,
        "notExecutedCount": 8
      },
      {
        "zoneName": "North Zone",
        "totalDelayedAudits": 15,
        "lapsedCount": 9,
        "notExecutedCount": 6
      },
      {
        "zoneName": "East Zone",
        "totalDelayedAudits": 11,
        "lapsedCount": 7,
        "notExecutedCount": 4
      }
    ]
  },
  "auditorStartedAfterSchedule": {
    "description": "Audit schedules where Audit Start Date is after the scheduled start date but within the audit end date.",
    "totalSchedulesWithLateStart": 12,
    "totalUniqueAuditors": 8,
    "displayedCount": 5,
    "remainingCount": 7,
    "items": [
      {
        "auditorName": "Jayam Sharma",
        "auditType": "Branch Compliance Audit",
        "auditeeName": "MG Road Branch",
        "scheduledStartDate": "2026-01-05",
        "auditStartDate": "2026-01-09"
      },
      {
        "auditorName": "Salim Khan",
        "auditType": "Regional Office Audit",
        "auditeeName": "NCR Regional Office",
        "scheduledStartDate": "2026-01-10",
        "auditStartDate": "2026-01-14"
      },
      {
        "auditorName": "Priya Nair",
        "auditType": "Branch Compliance Audit",
        "auditeeName": "Fort Branch",
        "scheduledStartDate": "2026-01-12",
        "auditStartDate": "2026-01-15"
      },
      {
        "auditorName": "Rahul Verma",
        "auditType": "Warehouse Audit",
        "auditeeName": "MIDC Unit 5",
        "scheduledStartDate": "2026-01-18",
        "auditStartDate": "2026-01-21"
      },
      {
        "auditorName": "Aishwarya Reddy",
        "auditType": "Branch Compliance Audit",
        "auditeeName": "Banjara Hills Branch",
        "scheduledStartDate": "2026-01-20",
        "auditStartDate": "2026-01-24"
      }
    ]
  },
  "topReAuditAuditors": {
    "description": "Top 10 auditors by re-audit percentage: audits sent to re-audit divided by total audits.",
    "topLimit": 10,
    "items": [
      {
        "auditorName": "Rahul Verma",
        "totalAudits": 25,
        "auditsGoneToReAudit": 21,
        "reAuditPercentage": 84
      },
      {
        "auditorName": "Aishwarya Reddy",
        "totalAudits": 22,
        "auditsGoneToReAudit": 18,
        "reAuditPercentage": 81.8
      },
      {
        "auditorName": "Salim Khan",
        "totalAudits": 28,
        "auditsGoneToReAudit": 22,
        "reAuditPercentage": 78.6
      },
      {
        "auditorName": "Priya Nair",
        "totalAudits": 20,
        "auditsGoneToReAudit": 15,
        "reAuditPercentage": 75
      },
      {
        "auditorName": "Jayam Sharma",
        "totalAudits": 30,
        "auditsGoneToReAudit": 21,
        "reAuditPercentage": 70
      },
      {
        "auditorName": "Deepak Rao",
        "totalAudits": 24,
        "auditsGoneToReAudit": 16,
        "reAuditPercentage": 66.7
      },
      {
        "auditorName": "Meena Pillai",
        "totalAudits": 21,
        "auditsGoneToReAudit": 13,
        "reAuditPercentage": 61.9
      },
      {
        "auditorName": "Anand Kulkarni",
        "totalAudits": 26,
        "auditsGoneToReAudit": 15,
        "reAuditPercentage": 57.7
      },
      {
        "auditorName": "Fatima Sheikh",
        "totalAudits": 18,
        "auditsGoneToReAudit": 9,
        "reAuditPercentage": 50
      },
      {
        "auditorName": "Vikram Tiwari",
        "totalAudits": 32,
        "auditsGoneToReAudit": 15,
        "reAuditPercentage": 46.9
      }
    ]
  }
}